{"$id":"https://dji.com/schemas/fh2-plugin/backend-plugin-source.schema.json","$schema":"http://json-schema.org/draft-07/schema#","additionalProperties":false,"definitions":{"configField":{"additionalProperties":false,"properties":{"description":{"type":"string"},"name":{"minLength":1,"type":"string"},"required":{"type":"boolean"},"secret":{"type":"boolean"},"type":{"enum":["string","number","bool"]}},"required":["name","type"],"type":"object"},"connection":{"additionalProperties":false,"properties":{"description":{"type":"string"},"id":{"minLength":1,"type":"string"},"requires":{"items":{"$ref":"#/definitions/configField"},"type":"array"}},"required":["id"],"type":"object"},"entity":{"additionalProperties":false,"properties":{"fields":{"additionalProperties":{"$ref":"#/definitions/entityField"},"minProperties":1,"type":"object"},"name":{"minLength":1,"type":"string"}},"required":["name","fields"],"type":"object"},"entityField":{"additionalProperties":false,"properties":{"indexed":{"type":"boolean"},"type":{"enum":["string","number","boolean","datetime","json"]},"unique":{"type":"boolean"}},"required":["type"],"type":"object"},"evaluator":{"additionalProperties":false,"anyOf":[{"required":["path"]},{"required":["entry"]}],"properties":{"description":{"type":"string"},"entry":{"pattern":"^[A-Za-z_$][A-Za-z0-9_$]*$","type":"string"},"io":{"$ref":"#/definitions/io"},"name":{"minLength":1,"type":"string"},"path":{"minLength":1,"type":"string"}},"required":["name"],"type":"object"},"event":{"additionalProperties":false,"properties":{"consumer":{"items":{"$ref":"#/definitions/eventConsumer"},"minItems":1,"type":"array"},"description":{"type":"string"},"match":{"additionalProperties":{"type":"string"},"propertyNames":{"minLength":1},"type":"object"},"type":{"minLength":1,"type":"string"}},"required":["type","consumer"],"type":"object"},"eventConsumer":{"additionalProperties":false,"anyOf":[{"required":["handler"]},{"required":["entry"]}],"properties":{"entry":{"pattern":"^[A-Za-z_$][A-Za-z0-9_$]*$","type":"string"},"handler":{"minLength":1,"type":"string"}},"type":"object"},"io":{"additionalProperties":false,"properties":{"inputs":{"items":{"$ref":"#/definitions/ioField"},"type":"array"},"outputs":{"items":{"$ref":"#/definitions/ioField"},"type":"array"}},"type":"object"},"ioField":{"additionalProperties":false,"properties":{"fields":{"items":{"$ref":"#/definitions/ioField"},"type":"array"},"name":{"minLength":1,"type":"string"},"required":{"type":"boolean"},"type":{"enum":["string","number","bool","object","array"]}},"required":["name","type"],"type":"object"},"script":{"additionalProperties":false,"anyOf":[{"required":["path"]},{"required":["entry"]}],"properties":{"allowlist":{"items":{"minLength":1,"type":"string"},"type":"array"},"description":{"type":"string"},"entry":{"pattern":"^[A-Za-z_$][A-Za-z0-9_$]*$","type":"string"},"io":{"$ref":"#/definitions/io"},"name":{"minLength":1,"type":"string"},"path":{"minLength":1,"type":"string"}},"type":"object"}},"description":"Toolchain source-contract 实际消费的 fh2-plugin.json Schema；未知字段拒绝。","properties":{"allowlist":{"items":{"minLength":1,"type":"string"},"type":"array"},"connections":{"items":{"$ref":"#/definitions/connection"},"type":"array"},"contractsRange":{"type":"string"},"description":{"type":"string"},"entities":{"items":{"$ref":"#/definitions/entity"},"type":"array"},"evaluators":{"items":{"$ref":"#/definitions/evaluator"},"type":"array"},"eventStatuses":{"items":{"minLength":1,"type":"string"},"type":"array"},"events":{"items":{"$ref":"#/definitions/event"},"type":"array"},"flows":{"items":{"minLength":1,"type":"string"},"type":"array"},"name":{"minLength":1,"type":"string"},"pluginId":{"maxLength":64,"minLength":1,"type":"string"},"puid":{"type":"string"},"scripts":{"items":{"$ref":"#/definitions/script"},"type":"array"},"slots":{"items":{"minLength":1,"type":"string"},"type":"array"},"version":{"minLength":1,"type":"string"}},"required":["pluginId","name","version"],"title":"FH2 Backend Plugin Source Manifest","type":"object"}
